topic,main_keyword,product_focus,category,status
Why Is My Dog Always Hungry?,dog always hungry,Training Treats,dog behavior,pending
Are Bully Sticks Safe for Puppies?,bully sticks for puppies,Bully Sticks,puppy chews,pending
Best Dog Chews for Bored Dogs,dog chews for boredom,Cow Ears,enrichment,pending
Can Dogs Eat Sweet Potatoes?,can dogs eat sweet potatoes,Sweet Potato Treats,dog nutrition,pending
How to Stop Dogs Begging for Food,dog begging for food,Training Treats,dog behavior,pending
Cow Ears vs Pig Ears for Dogs,cow ears vs pig ears,Cow Ears,chew comparison,pending
Are Pig Ears Safe for Dogs?,are pig ears safe for dogs,Pig Ears,dog chews,pending
Best Rawhide Alternatives for Dogs,rawhide alternatives for dogs,Bully Sticks,dog chews,pending
How Long Should a Dog Chew a Bully Stick?,how long should dog chew bully stick,Bully Sticks,dog chew safety,pending
Best Treats for Training Puppies,puppy training treats,Training Treats,puppy training,pending
Why Do Dogs Chew Everything?,why do dogs chew,Bully Sticks,dog behavior,pending
Best Dog Treats for Picky Eaters,dog treats for picky eaters,Beef Lung Bites,dog treats,pending
Can Dogs Eat Pumpkin?,can dogs eat pumpkin,Sweet Potato Sticks Pumpkin & Cinnamon,dog nutrition,pending
Best Dental Chews for Senior Dogs,dental chews for senior dogs,Bully Sticks,dental chews,pending
How to Keep Dogs Busy Indoors,keep dogs busy indoors,Beef Cheek Rolls,enrichment,pending
Best Long Lasting Dog Chews,long lasting dog chews,Beef Cheek Rolls,dog chews,pending
Are Sweet Potato Dog Treats Healthy?,sweet potato dog treats,Sweet Potato Fries,dog treats,pending
How Many Treats Can a Dog Have Per Day?,how many treats can a dog have,Training Treats,dog nutrition,pending
Best Chews for Power Chewers,best chews for power chewers,Beef Cheek Rolls,dog chews,pending
Can Dogs Eat Chicken Jerky?,can dogs eat chicken jerky,Chicken Jerky,dog treats,pending
Best Dog Treats for Sensitive Stomachs,dog treats for sensitive stomachs,Sweet Potato Treats,dog treats,pending
Why Does My Dog Hide Treats?,why do dogs hide treats,Bully Sticks,dog behavior,pending
Best Treat Routine for Dogs,dog treat routine,Training Treats,dog routine,pending
Can Dog Chews Help With Boredom?,dog chews for boredom,Cow Ears,enrichment,pending
How to Introduce a New Dog Chew,introduce new dog chew,Bully Sticks,dog chew safety,pending
Best Dog Treats for Recall Training,recall training treats,Training Treats,dog training,pending
Are Cow Ears Digestible for Dogs?,are cow ears digestible,Cow Ears,dog chews,pending
Why Dogs Love Bully Sticks,why dogs love bully sticks,Bully Sticks,dog chews,pending
Best Single Ingredient Dog Treats,single ingredient dog treats,Beef Lung Bites,dog treats,pending
Can Dogs Eat Salmon Treats?,salmon dog treats,Sweet Potato Sticks Salmon & Kelp,dog nutrition,pending
Best Treats for Small Dogs,treats for small dogs,Training Treats,dog treats,pending
Best Chews for Large Dogs,chews for large dogs,Beef Cheek Rolls,dog chews,pending
How to Choose Safe Dog Chews,safe dog chews,Bully Sticks,dog chew safety,pending
Can Dogs Eat Peanut Butter Treats?,peanut butter dog treats,Peanut Butter Training Treats,dog nutrition,pending
Best Dog Treats for Enrichment,dog enrichment treats,Bully Sticks,enrichment,pending
Why Is My Dog So Food Motivated?,food motivated dog,Training Treats,dog behavior,pending
How to Use Treats Without Overfeeding,how to use treats without overfeeding,Training Treats,dog nutrition,pending
Best Treats for Senior Dogs,senior dog treats,Sweet Potato Treats,senior dogs,pending
Can Puppies Have Cow Ears?,can puppies have cow ears,Cow Ears,puppy chews,pending
Best Treats for Crate Training,crate training treats,Training Treats,dog training,pending
Are Beef Lung Treats Good for Dogs?,beef lung treats for dogs,Beef Lung Bites,dog treats,pending
Best Natural Dog Chews,natural dog chews,Bully Sticks,dog chews,pending
Why Dogs Need Chewing Enrichment,dog chewing enrichment,Cow Ears,enrichment,pending
Best Treats for Dogs on a Diet,low calorie dog treats,Sweet Potato Fries,dog nutrition,pending
Can Dogs Eat Apple Cinnamon Treats?,apple cinnamon dog treats,Sweet Potato Sticks Apple & Cinnamon,dog nutrition,pending
Best Dog Chews for Anxiety Boredom,dog chews for anxiety boredom,Bully Sticks,enrichment,pending
How to Stop Counter Surfing in Dogs,stop dog counter surfing,Training Treats,dog training,pending
Best Dog Treats for Walks,dog treats for walks,Training Treats,dog training,pending
How to Store Natural Dog Treats,how to store natural dog treats,All Natural Treats,dog treats,pending
Can Dogs Eat Beef Cheek Rolls?,beef cheek rolls for dogs,Beef Cheek Rolls,dog chews,pending
